<?xml version="1.0" encoding="ISO-8859-1"?>
<!DOCTYPE arm PUBLIC "-//Entorno3D//doctypes/dtdArm.dtd" "http://monkeyarm.googlecode.com/files/dtdArm.dtd">
<arm version="1.0">
    <content>
        <support>0.0, -1.0, 0.0</support>
        <position>0.0, 0.0, 0.0</position>
        <joint src="designs/JntBase.dae" axis="y" motion="rotational">
            <position>0.0, 0.0, 0.0</position>
            <orientation>0.0, 0.0, 0.0</orientation>
            <jorientation class="current">0.0</jorientation>
            <jorientation class="min">0.0</jorientation>
            <jorientation class="max">360.0</jorientation>
            <joint src="designs/JntNormal1.dae" axis="x" motion="rotational">
                <position>0.0, 0.44000000000000006, 0.0</position>
                <orientation>0.0, 0.0, 0.0</orientation>
                <jorientation class="current">320.0</jorientation>
                <jorientation class="min">320.0</jorientation>
                <jorientation class="max">440.0</jorientation>
                <piece src="designs/sgmNormal1.dae" type="segment">
                    <position>0.03, 0.52, -0.41000000000000014</position>
                    <orientation>0.0, 0.0, 0.0</orientation>
                </piece>
                <joint src="designs/JntNormal1.dae" axis="x" motion="rotational">
                    <position>0.060000000000000005, 1.05, -0.7800000000000002</position>
                    <orientation>0.0, 183.0, 0.0</orientation>
                    <jorientation class="current">360.0</jorientation>
                    <jorientation class="min">200.0</jorientation>
                    <jorientation class="max">360.0</jorientation>
                    <piece src="designs/sgmNormal2.dae" type="segment">
                        <position>-0.04, -0.35000000000000003, 1.04</position>
                        <orientation>0.0, 2.0, 0.0</orientation>
                    </piece>
                    <joint src="designs/JntArm1.dae" axis="x" motion="rotational">
                        <position>-0.13999999999999999, -0.77, 2.3200000000000003</position>
                        <orientation>0.0, 0.0, 0.0</orientation>
                        <jorientation class="current">379.0</jorientation>
                        <jorientation class="min">300.0</jorientation>
                        <jorientation class="max">420.0</jorientation>
                        <piece src="designs/PalmNormal1.dae" type="segment">
                            <position>-0.040000000000000015, -0.17, 0.3699999999999998</position>
                            <orientation>0.0, 0.0, 0.0</orientation>
                        </piece>
                        <joint src="designs/FngJntNmlLeft.dae" axis="y" motion="rotational">
                            <position>0.12999999999999998, -0.03, 0.8800000000000001</position>
                            <orientation>0.0, 11.0, 0.0</orientation>
                            <jorientation class="current">356.0</jorientation>
                            <jorientation class="min">330.0</jorientation>
                            <jorientation class="max">390.0</jorientation>
                            <piece src="designs/FingerNrm1.dae" type="segment">
                                <position>0.09, 0.0, 0.4200000000000002</position>
                                <orientation>0.0, 0.0, 0.0</orientation>
                            </piece>
                        </joint>
                        <joint src="designs/FngJntNmlRight.dae" axis="y" motion="rotational">
                            <position>-0.36, 0.0, 0.8700000000000001</position>
                            <orientation>0.0, 0.0, 0.0</orientation>
                            <jorientation class="current">361.0</jorientation>
                            <jorientation class="min">340.0</jorientation>
                            <jorientation class="max">380.0</jorientation>
                            <piece src="designs/FingerNrm1.dae" type="segment">
                                <position>-0.07, 0.010000000000000028, 0.44000000000000017</position>
                                <orientation>0.0, 55.0, 0.0</orientation>
                            </piece>
                        </joint>
                    </joint>
                </joint>
            </joint>
        </joint>
    </content>
</arm>
