<?xml version="1.0" encoding="ISO-8859-1"?>
<!DOCTYPE arm PUBLIC "-//Entorno3D//doctypes/dtdArm.dtd//EN" "http://monkeyarm.googlecode.com/files/dtdArm.dtd">
<arm version="1.0">
<content>
<support>0.0, -1.0, 0.0</support>
<position>0.0, 0.0, 0.0</position>
<joint src="Segment1.dae" axis="y" motion="rotational">
<position>0.0, 0.55, 0.0</position>
<orientation>0.0, 0.0, 0.0</orientation>
<jorientation class="current">192.0</jorientation>
<jorientation class="min">0.0</jorientation>
<jorientation class="max">360.0</jorientation>
<joint src="Joint1.dae" axis="y" motion="translational">
<position>0.0, -0.4, 0.0</position>
<orientation>0.0, 0.0, 0.0</orientation>
<jorientation class="current">0.8999999798834324</jorientation>
<jorientation class="min">0.0</jorientation>
<jorientation class="max">90.0</jorientation>
<piece src="Segment2.dae" type="segment">
<position>0.7200000000000001, 0.0, 0.0</position>
<orientation>90.0, 180.0, 90.0</orientation>
</piece>
<joint src="Joint2.dae" axis="x" motion="translational">
<position>0.28000000000000014, 0.0, 0.0</position>
<orientation>0.0, 0.0, 90.0</orientation>
<jorientation class="current">0.6099999863654375</jorientation>
<jorientation class="min">1.0</jorientation>
<jorientation class="max">90.0</jorientation>
<joint src="Joint1.dae" axis="x" motion="rotational">
<position>0.0, 0.0, 0.0</position>
<orientation>0.0, 0.0, 90.0</orientation>
<jorientation class="current">0.0</jorientation>
<jorientation class="min">0.0</jorientation>
<jorientation class="max">360.0</jorientation>
</joint>
</joint>
</joint>
</joint>
</content>
</arm>
